{"algorithm":"reproassert-v02-leak-audited-cohort-plan-v1","case_count":20,"cases":[{"base_sha":"cdb66059a2feb44ee49021874605ba90801f9986","case_id":"rk-v0.2-001","case_plan_sha256":"f693e7ce826d424148764ac7935c2268ad5393c330c9a0b96ee9751c62216046","difficulty":"lt_15m","instance_id":"astropy__astropy-14309","issue_text_sha256":"27b74ed7081579a5f310188d6ed6ac4da1d785c492b00052d605b7ba04d036b9","issue_url":"https://github.com/astropy/astropy/issues/14305","issue_url_provenance":"controller_selected_v0.1_mapping_chronology_unproven","oracle_leak_audit":{"direct_own_fixing_pr_reference":false,"minimum_exact_added_line_characters":40,"oracle_leak_free":true,"production_added_line_overlap":false,"test_added_line_overlap":false},"replaced_instance_id":null,"replacement_rule":"not_applicable","repo":"astropy/astropy","selection_origin":"v0.1_migration","source_dataset_row_ordinal":9,"tdd_membership_ordinal":8},{"base_sha":"26d147868f8a891a6009a25cd6a8576d2e1bd747","case_id":"rk-v0.2-002","case_plan_sha256":"39479cfaac6f28516327d8e744c683547a94eeb0c18d63e483a17afe88695112","difficulty":"lt_15m","instance_id":"astropy__astropy-7166","issue_text_sha256":"70c79d6da0284ce81f9e951dbab5c77d94bf8a27cd156f54169b424d75d11e43","issue_url":"https://github.com/astropy/astropy/issues/7162","issue_url_provenance":"current_fixing_pr_body_mapping_unauthenticated_chronology_unproven","oracle_leak_audit":{"direct_own_fixing_pr_reference":false,"minimum_exact_added_line_characters":40,"oracle_leak_free":true,"production_added_line_overlap":false,"test_added_line_overlap":false},"replaced_instance_id":"astropy__astropy-14995","replacement_rule":"lowest_tdd_membership_ordinal_same_repo_and_difficulty_passing_mechanical_oracle_audit","repo":"astropy/astropy","selection_origin":"deterministic_tdd_membership_replacement","source_dataset_row_ordinal":16,"tdd_membership_ordinal":15},{"base_sha":"d16bfe05a744909de4b27f5875fe0d4ed41ce607","case_id":"rk-v0.2-003","case_plan_sha256":"f6cd3f0bd560f59e10c602d1340dd00b24d2adbf68ab3be5aa5796176222c23f","difficulty":"15m_to_1h","instance_id":"astropy__astropy-12907","issue_text_sha256":"c01334ec1b21a089c650cf2e7b96ab974469076bf1260d23885799e1f0a7551f","issue_url":"https://github.com/astropy/astropy/issues/12906","issue_url_provenance":"current_fixing_pr_body_mapping_unauthenticated_chronology_unproven","oracle_leak_audit":{"direct_own_fixing_pr_reference":false,"minimum_exact_added_line_characters":40,"oracle_leak_free":true,"production_added_line_overlap":false,"test_added_line_overlap":false},"replaced_instance_id":"astropy__astropy-7606","replacement_rule":"lowest_tdd_membership_ordinal_same_repo_and_difficulty_passing_mechanical_oracle_audit","repo":"astropy/astropy","selection_origin":"deterministic_tdd_membership_replacement","source_dataset_row_ordinal":0,"tdd_membership_ordinal":1},{"base_sha":"af39f1edffcd828f05cfdd04f2e59506bb4a27bc","case_id":"rk-v0.2-004","case_plan_sha256":"c24a90fe5811a8e5571460b1554482723cc5478ca915292cc58aa34af95834c9","difficulty":"lt_15m","instance_id":"matplotlib__matplotlib-24149","issue_text_sha256":"e45198b3ac6b31622abb846680415a32e52d5ed8fc60c85953b9f0deb461b6af","issue_url":"https://github.com/matplotlib/matplotlib/issues/24127","issue_url_provenance":"controller_selected_v0.1_mapping_chronology_unproven","oracle_leak_audit":{"direct_own_fixing_pr_reference":false,"minimum_exact_added_line_characters":40,"oracle_leak_free":true,"production_added_line_overlap":false,"test_added_line_overlap":false},"replaced_instance_id":null,"replacement_rule":"not_applicable","repo":"matplotlib/matplotlib","selection_origin":"v0.1_migration","source_dataset_row_ordinal":268,"tdd_membership_ordinal":245},{"base_sha":"430fb1db88843300fb4baae3edc499bbfe073b0c","case_id":"rk-v0.2-005","case_plan_sha256":"2cdb94310a9f05e4ff8dcf2b32bcbea7506bb7f8d36677a27a2b40c81d9f5ee8","difficulty":"lt_15m","instance_id":"matplotlib__matplotlib-25311","issue_text_sha256":"a2583ca80e1609006e02901af35754c41bc9bb0c325da37d2f6fef434d7f2ff7","issue_url":"https://github.com/matplotlib/matplotlib/issues/25300","issue_url_provenance":"controller_selected_v0.1_mapping_chronology_unproven","oracle_leak_audit":{"direct_own_fixing_pr_reference":false,"minimum_exact_added_line_characters":40,"oracle_leak_free":true,"production_added_line_overlap":false,"test_added_line_overlap":false},"replaced_instance_id":null,"replacement_rule":"not_applicable","repo":"matplotlib/matplotlib","selection_origin":"v0.1_migration","source_dataset_row_ordinal":277,"tdd_membership_ordinal":254},{"base_sha":"1c8668b0a021832386470ddf740d834e02c66f69","case_id":"rk-v0.2-006","case_plan_sha256":"7a91c6beff4df49c825d28d7b81db1f323b27836862193536d3c7f5b77dfad3a","difficulty":"lt_15m","instance_id":"scikit-learn__scikit-learn-13142","issue_text_sha256":"09d29f40006ebbae91aeab363c05beda6131a0d3ddee55d1d9581619e065d6d1","issue_url":"https://github.com/scikit-learn/scikit-learn/issues/13070","issue_url_provenance":"controller_selected_v0.1_mapping_chronology_unproven","oracle_leak_audit":{"direct_own_fixing_pr_reference":false,"minimum_exact_added_line_characters":40,"oracle_leak_free":true,"production_added_line_overlap":false,"test_added_line_overlap":false},"replaced_instance_id":null,"replacement_rule":"not_applicable","repo":"scikit-learn/scikit-learn","selection_origin":"v0.1_migration","source_dataset_row_ordinal":359,"tdd_membership_ordinal":327},{"base_sha":"37b0e66c871e8fb032a9c7086b2a1d5419838154","case_id":"rk-v0.2-007","case_plan_sha256":"7e643fc077ef4a8d0c17d30b664ec0e732666d20989692722284c6fe451256b5","difficulty":"lt_15m","instance_id":"scikit-learn__scikit-learn-13328","issue_text_sha256":"c9bb5529b14627fcae2c8af8e3a21bcb6aa2996a2fab228ef52f32bbed489194","issue_url":"https://github.com/scikit-learn/scikit-learn/issues/13314","issue_url_provenance":"controller_selected_v0.1_mapping_chronology_unproven","oracle_leak_audit":{"direct_own_fixing_pr_reference":false,"minimum_exact_added_line_characters":40,"oracle_leak_free":true,"production_added_line_overlap":false,"test_added_line_overlap":false},"replaced_instance_id":null,"replacement_rule":"not_applicable","repo":"scikit-learn/scikit-learn","selection_origin":"v0.1_migration","source_dataset_row_ordinal":360,"tdd_membership_ordinal":328},{"base_sha":"6ab8c86c383dd847a1be7103ad115f174fe23ffd","case_id":"rk-v0.2-008","case_plan_sha256":"78736bf8ac8a0c91e168a15d351834868152ecee6a752bdec073dad61d0acb07","difficulty":"15m_to_1h","instance_id":"scikit-learn__scikit-learn-14053","issue_text_sha256":"4bfeec31c05255ebf71795aa346b58c911563bf4a11dac38c2e20e73f2b2d267","issue_url":"https://github.com/scikit-learn/scikit-learn/issues/13976","issue_url_provenance":"controller_selected_v0.1_mapping_chronology_unproven","oracle_leak_audit":{"direct_own_fixing_pr_reference":false,"minimum_exact_added_line_characters":40,"oracle_leak_free":true,"production_added_line_overlap":false,"test_added_line_overlap":false},"replaced_instance_id":null,"replacement_rule":"not_applicable","repo":"scikit-learn/scikit-learn","selection_origin":"v0.1_migration","source_dataset_row_ordinal":364,"tdd_membership_ordinal":332},{"base_sha":"cb828ebe70b4fa35cd5f9a7ee024272237eab351","case_id":"rk-v0.2-009","case_plan_sha256":"ea9f3fb92527af7497ba15f84619b1860035dbb6da7cf29a45b5b3520cb6a0fd","difficulty":"15m_to_1h","instance_id":"pytest-dev__pytest-5631","issue_text_sha256":"1e9120fbb21d881c388af3596eaa479bad2f604703eb79bd19898b5d7b18af03","issue_url":"https://github.com/pytest-dev/pytest/issues/5606","issue_url_provenance":"controller_selected_v0.1_mapping_chronology_unproven","oracle_leak_audit":{"direct_own_fixing_pr_reference":false,"minimum_exact_added_line_characters":40,"oracle_leak_free":true,"production_added_line_overlap":false,"test_added_line_overlap":false},"replaced_instance_id":null,"replacement_rule":"not_applicable","repo":"pytest-dev/pytest","selection_origin":"v0.1_migration","source_dataset_row_ordinal":334,"tdd_membership_ordinal":305},{"base_sha":"a7e38c5c61928033a2dc1915cbee8caa8544a4d0","case_id":"rk-v0.2-010","case_plan_sha256":"c49c7c09e47c8fbdeddcdfaffbf2a60d821b8b4b5a0007a96cb04e0200208c76","difficulty":"lt_15m","instance_id":"pytest-dev__pytest-7982","issue_text_sha256":"90201d780cf37fdf665a7ea9c601714391d34ccc8bb513bf3e7d5f3e667e49da","issue_url":"https://github.com/pytest-dev/pytest/issues/7981","issue_url_provenance":"controller_selected_v0.1_mapping_chronology_unproven","oracle_leak_audit":{"direct_own_fixing_pr_reference":false,"minimum_exact_added_line_characters":40,"oracle_leak_free":true,"production_added_line_overlap":false,"test_added_line_overlap":false},"replaced_instance_id":null,"replacement_rule":"not_applicable","repo":"pytest-dev/pytest","selection_origin":"v0.1_migration","source_dataset_row_ordinal":347,"tdd_membership_ordinal":315},{"base_sha":"19b088636eb7d3f65ab7a1046ac672e0689371d8","case_id":"rk-v0.2-011","case_plan_sha256":"3e89170f1eb5f2fe2d22f3353adefa8e2a2cdb79ddb6eb60a8d1e821fad80916","difficulty":"lt_15m","instance_id":"pydata__xarray-4075","issue_text_sha256":"d1cc08eec285573fc56f2a58a623e0b7adf33e6f75fd16b4214dd1db4b3e46a6","issue_url":"https://github.com/pydata/xarray/issues/4074","issue_url_provenance":"controller_selected_v0.1_mapping_chronology_unproven","oracle_leak_audit":{"direct_own_fixing_pr_reference":false,"minimum_exact_added_line_characters":40,"oracle_leak_free":true,"production_added_line_overlap":false,"test_added_line_overlap":false},"replaced_instance_id":null,"replacement_rule":"not_applicable","repo":"pydata/xarray","selection_origin":"v0.1_migration","source_dataset_row_ordinal":304,"tdd_membership_ordinal":276},{"base_sha":"a64cf2d5476e7bbda099b34c40b7be1880dbd39a","case_id":"rk-v0.2-012","case_plan_sha256":"3b6e4538cf942a4a8f02ad0049a6e4bae150e2b2d4f1bb9bd349f30aa864cfb6","difficulty":"lt_15m","instance_id":"pydata__xarray-4094","issue_text_sha256":"4c60cee2e4247fd72e76052ae5938216ea38eca360d5b87d2a006d71bf4a91bc","issue_url":"